<!ELEMENT dialogue (situation?, replique+)>
<!ELEMENT situation (#PCDATA)>
<!ELEMENT replique (personnage, texte)>
<!ELEMENT personnage (#PCDATA)>
<!ELEMENT texte (#PCDATA)>

